{
    "schema_version":  "1.0.0",
    "handoff_id":  "handoff.p4.analyst_to_theorist.001",
    "run_id":  "run.p4.preliminary.20260801t140000z",
    "phase":  "P4",
    "sequence":  1,
    "from_role":  "data_analyst",
    "to_role":  "theorist",
    "producer_profile_input_id":  "input.profile.data_analyst",
    "method_identity":  {
                            "stable_id":  "method.overlap_stabilized_score",
                            "version":  1,
                            "definition_sha256":  "1111111111111111111111111111111111111111111111111111111111111111"
                        },
    "basis_generation_ids":  [
                                 "generation.method.001",
                                 "generation.catalog.002"
                             ],
    "completed_work":  [
                           "Implemented the exact version 1 estimating equation and completed the prespecified preliminary simulation grid.",
                           "Recorded bias, root mean squared error, interval coverage, Monte Carlo error, code, configuration, seed, and computing environment."
                       ],
    "material_changes":  [
                             "No method definition was changed during this run.",
                             "The candidate empirical evidence index contains one exact-method preliminary simulation result."
                         ],
    "statement_ids":  [
                          "claim.rmse.reduction"
                      ],
    "evidence_ids":  [
                         "evidence.simulation.preliminary.001"
                     ],
    "unresolved_issues":  [
                              {
                                  "issue_id":  "issue.variance_normalization_check",
                                  "category":  "validity",
                                  "severity":  "major",
                                  "statement":  "The analyst requests an independent check that the variance normalization matches Definition 1.",
                                  "consequence":  "A mismatch would invalidate the reported interval coverage while leaving point-estimate error summaries potentially usable."
                              }
                          ],
    "required_checks":  [
                            "Verify that the simulated estimator, variance normalization, and clipping parameter match method version 1.",
                            "Restrict any scientific conclusion to the evaluated data-generating processes."
                        ],
    "handoff_artifact":  {
                             "artifact_id":  "artifact.analyst_handoff",
                             "uri":  "run://run.p4.preliminary.20260801t140000z/artifact/artifact.analyst_handoff",
                             "path":  "runs/P4/run.p4.preliminary.20260801t140000z/roles/01-data_analyst/analyst-to-theorist-handoff.json",
                             "sha256":  "bbbbbbbbbbbbbbbbbbbbbbbbbbbbbbbbbbbbbbbbbbbbbbbbbbbbbbbbbbbbbbbb",
                             "media_type":  "application/json"
                         },
    "created_at":  "2026-08-01T14:50:00Z"
}